{
  "submittedUrl": "https://www.youtube.com/watch?v=M2djoKmnOTY",
  "whyItShouldGrow": "Its near-future Brooklyn, hip-hop identity, and supernatural horror already suggest a distinctive animated world worth scouting.",
  "submissionType": "fan",
  "suggestedFormat": "An adult animated series or independent feature",
  "audienceFit": "Fans of creator-led animation, psychological horror, manga, and hip-hop storytelling.",
  "supportingUrls": ["https://www.instagram.com/reel/DboaCLPIHot/"]
}
